<?xml version="1.0" encoding="utf-8"?>
<CMAData xmlns:xsi="http://www.w3.org/2001/XMLSchema-instance"
        xsi:noNamespaceSchemaLocation="CMALibrary.xsd">
	<Version>1</Version>
	<Environment>
		<Tin>21</Tin>
		<Tout>-18</Tout>
	</Environment>
	<GlazingConductance>
		<Low>0.498817</Low>
		<High>5.880546</High>
	</GlazingConductance>
	<SpacerConductivity>
		<Low>0.01</Low>
		<High>10</High>
	</SpacerConductivity>
	<SingleLayer>
		<Thickness>0.006</Thickness>
		<Conductivity>1</Conductivity>
		<Options>
			<Glazing>Low</Glazing>
			<Spacer>Low</Spacer>
			<hcin>3.415185</hcin>
			<hcout>26</hcout>
			<EmissivityIn>0.026</EmissivityIn>
			<EmissivityOut>0.84</EmissivityOut>
		</Options>
		<Options>
			<Glazing>Low</Glazing>
			<Spacer>High</Spacer>
			<hcin>3.415185</hcin>
			<hcout>26</hcout>
			<EmissivityIn>0.026</EmissivityIn>
			<EmissivityOut>0.84</EmissivityOut>
		</Options>
		<Options>
			<Glazing>High</Glazing>
			<Spacer>Low</Spacer>
			<hcin>3.529954</hcin>
			<hcout>26</hcout>
			<EmissivityIn>0.84</EmissivityIn>
			<EmissivityOut>0.84</EmissivityOut>
		</Options>
		<Options>
			<Glazing>High</Glazing>
			<Spacer>High</Spacer>
			<hcin>3.529954</hcin>
			<hcout>26</hcout>
			<EmissivityIn>0.84</EmissivityIn>
			<EmissivityOut>0.84</EmissivityOut>
		</Options>
	</SingleLayer>
	<DoubleLayer>
		<Thickness1>0.006</Thickness1>
		<Thickness2>0.006</Thickness2>
		<Conductivity1>1</Conductivity1>
		<Conductivity2>1</Conductivity2>
		<Options>
			<Glazing>Low</Glazing>
			<Spacer>Low</Spacer>
			<hcin>1.854252</hcin>
			<hcout>26</hcout>
			<EmissivityIn>0.84</EmissivityIn>
			<EmissivityOut>0.84</EmissivityOut>
		</Options>
		<Options>
			<Glazing>Low</Glazing>
			<Spacer>High</Spacer>
			<hcin>1.854252</hcin>
			<hcout>26</hcout>
			<EmissivityIn>0.84</EmissivityIn>
			<EmissivityOut>0.84</EmissivityOut>
		</Options>
		<Options>
			<Glazing>High</Glazing>
			<Spacer>Low</Spacer>
			<hcin>2.866122</hcin>
			<hcout>26</hcout>
			<EmissivityIn>0.84</EmissivityIn>
			<EmissivityOut>0.84</EmissivityOut>
		</Options>
		<Options>
			<Glazing>High</Glazing>
			<Spacer>High</Spacer>
			<hcin>2.866122</hcin>
			<hcout>26</hcout>
			<EmissivityIn>0.84</EmissivityIn>
			<EmissivityOut>0.84</EmissivityOut>
		</Options>
	</DoubleLayer>
</CMAData>
